{
  "$schema": "http://json-schema.org/draft-07/schema#",
  "type": "object",
  "required": ["kind", "schema_version", "metadata", "notetypes", "notes"],
  "additionalProperties": false,
  "properties": {
    "kind": {
      "const": "authoring-ir"
    },
    "schema_version": {
      "type": "string",
      "minLength": 1
    },
    "metadata": {
      "type": "object",
      "required": ["document_id"],
      "additionalProperties": false,
      "properties": {
        "document_id": {
          "type": "string",
          "minLength": 1
        }
      }
    },
    "notetypes": {
      "type": "array",
      "items": {
        "$ref": "#/$defs/authoring_notetype"
      }
    },
    "notes": {
      "type": "array",
      "items": {
        "$ref": "#/$defs/authoring_note"
      }
    },
    "media": {
      "type": "array",
      "default": [],
      "items": {
        "$ref": "#/$defs/authoring_media"
      }
    }
  },
  "$defs": {
    "authoring_notetype": {
      "type": "object",
      "required": ["id", "kind"],
      "additionalProperties": false,
      "properties": {
        "id": {
          "type": "string",
          "minLength": 1
        },
        "kind": {
          "enum": ["normal", "cloze"]
        },
        "name": {
          "type": "string",
          "minLength": 1
        },
        "original_stock_kind": {
          "type": "string",
          "minLength": 1
        },
        "original_id": {
          "type": "integer"
        },
        "fields": {
          "type": "array",
          "minItems": 1,
          "items": {
            "$ref": "#/$defs/authoring_field"
          }
        },
        "templates": {
          "type": "array",
          "minItems": 1,
          "items": {
            "$ref": "#/$defs/authoring_template"
          }
        },
        "css": {
          "type": "string"
        },
        "field_metadata": {
          "type": "array",
          "default": [],
          "items": {
            "$ref": "#/$defs/authoring_field_metadata"
          }
        }
      }
    },
    "authoring_field": {
      "type": "object",
      "required": ["name"],
      "additionalProperties": false,
      "properties": {
        "name": {
          "type": "string",
          "minLength": 1
        },
        "ord": {
          "type": "integer",
          "minimum": 0
        },
        "config_id": {
          "type": "integer"
        },
        "tag": {
          "type": "integer",
          "minimum": 0
        },
        "prevent_deletion": {
          "type": "boolean",
          "default": false
        },
        "sort": {
          "type": "boolean",
          "default": false
        }
      }
    },
    "authoring_template": {
      "type": "object",
      "required": ["name", "question_format", "answer_format"],
      "additionalProperties": false,
      "properties": {
        "name": {
          "type": "string",
          "minLength": 1
        },
        "ord": {
          "type": "integer",
          "minimum": 0
        },
        "config_id": {
          "type": "integer"
        },
        "question_format": {
          "type": "string",
          "minLength": 1
        },
        "answer_format": {
          "type": "string",
          "minLength": 1
        },
        "browser_question_format": {
          "type": "string",
          "minLength": 1
        },
        "browser_answer_format": {
          "type": "string",
          "minLength": 1
        },
        "target_deck_name": {
          "type": "string",
          "minLength": 1
        },
        "browser_font_name": {
          "type": "string",
          "minLength": 1
        },
        "browser_font_size": {
          "type": "integer",
          "minimum": 0
        },
        "generation_requirement": {
          "$ref": "#/$defs/generation_requirement"
        }
      }
    },
    "generation_requirement": {
      "type": "object",
      "required": ["kind", "field_names"],
      "additionalProperties": false,
      "properties": {
        "kind": {
          "enum": ["all", "any"]
        },
        "field_names": {
          "type": "array",
          "minItems": 1,
          "items": {
            "type": "string",
            "minLength": 1
          }
        }
      }
    },
    "authoring_field_metadata": {
      "type": "object",
      "required": ["field_name"],
      "additionalProperties": false,
      "properties": {
        "field_name": {
          "type": "string",
          "minLength": 1
        },
        "label": {
          "type": "string",
          "minLength": 1
        },
        "role_hint": {
          "type": "string",
          "minLength": 1
        }
      }
    },
    "authoring_note": {
      "type": "object",
      "required": ["id", "notetype_id", "deck_name", "fields"],
      "additionalProperties": false,
      "properties": {
        "id": {
          "type": "string",
          "minLength": 1
        },
        "notetype_id": {
          "type": "string",
          "minLength": 1
        },
        "deck_name": {
          "type": "string",
          "minLength": 1
        },
        "fields": {
          "type": "object",
          "minProperties": 1,
          "additionalProperties": {
            "type": "string"
          }
        },
        "tags": {
          "type": "array",
          "default": [],
          "items": {
            "type": "string",
            "minLength": 1
          }
        }
      }
    },
    "authoring_media": {
      "type": "object",
      "required": ["id", "desired_filename", "source"],
      "additionalProperties": false,
      "properties": {
        "id": {
          "type": "string",
          "minLength": 1
        },
        "desired_filename": {
          "type": "string",
          "minLength": 1
        },
        "source": {
          "oneOf": [
            { "$ref": "#/$defs/authoring_media_path_source" },
            { "$ref": "#/$defs/authoring_media_inline_bytes_source" }
          ]
        },
        "declared_mime": {
          "type": "string",
          "minLength": 1
        }
      }
    },
    "authoring_media_path_source": {
      "type": "object",
      "required": ["kind", "path"],
      "additionalProperties": false,
      "properties": {
        "kind": { "const": "path" },
        "path": { "type": "string", "minLength": 1 }
      }
    },
    "authoring_media_inline_bytes_source": {
      "type": "object",
      "required": ["kind", "data_base64"],
      "additionalProperties": false,
      "properties": {
        "kind": { "const": "inline_bytes" },
        "data_base64": { "type": "string", "minLength": 1 }
      }
    }
  }
}
