{
  "kind": "authoring-ir",
  "schema_version": "0.1.0",
  "metadata": {
    "document_id": "manual-s08-io-plus-audio"
  },
  "notetypes": [
    {
      "id": "io-main",
      "kind": "cloze",
      "original_stock_kind": "image_occlusion",
      "name": "Image Occlusion"
    }
  ],
  "notes": [
    {
      "id": "note-s08-1",
      "notetype_id": "io-main",
      "deck_name": "Default",
      "fields": {
        "Occlusion": "{{c1::Mask 1}}",
        "Image": "<img src=\"skull-io.png\">",
        "Header": "Skull Regions",
        "Back Extra": "[sound:io-explain.wav] region naming",
        "Comments": "manual io plus audio scenario"
      },
      "tags": [
        "manual",
        "s08",
        "io",
        "audio"
      ]
    }
  ],
  "media": [
    {
      "id": "media:skull-io.png",
      "desired_filename": "skull-io.png",
      "source": {
        "kind": "path",
        "path": "assets/skull-io.png"
      },
      "declared_mime": "image/png"
    },
    {
      "id": "media:io-explain.wav",
      "desired_filename": "io-explain.wav",
      "source": {
        "kind": "path",
        "path": "assets/io-explain.wav"
      },
      "declared_mime": "audio/wav"
    }
  ]
}
