{
  "kind": "authoring-ir",
  "schema_version": "0.1.0",
  "metadata": {
    "document_id": "demo-doc"
  },
  "notetypes": [
    {
      "id": "cloze-main",
      "kind": "cloze",
      "name": "Cloze"
    }
  ],
  "notes": [
    {
      "id": "note-1",
      "notetype_id": "cloze-main",
      "deck_name": "Default",
      "fields": {
        "Text": "A {{c1::cloze}} example",
        "Back Extra": "extra"
      },
      "tags": [
        "demo"
      ]
    }
  ],
  "media": []
}
